{
  "schemaVersion": 1,
  "productID": "tanjing",
  "bookID": "liuzutanjing",
  "editionID": "cbeta-t48n2008-2026r1-reference",
  "reviewStatus": "candidate",
  "releaseEligibility": "blocked",
  "approvals": {
    "textAccuracy": {
      "status": "pending",
      "notes": "No canonical transcription, chapter structure, or independent collation review has been approved."
    },
    "rights": {
      "status": "pending",
      "notes": "CBETA is a collation reference only until a commercial permission or an independently transcribed public-domain base is approved."
    }
  },
  "sources": [
    {
      "sourceID": "tanjing.source.cbeta-t48n2008",
      "role": "collation-reference",
      "format": "tei-xml",
      "title": "六祖大師法寶壇經",
      "institution": "CBETA 中華電子佛典協會",
      "canonicalIdentifier": "Taisho T2008",
      "sourceHeaderAttribution": {
        "zh-Hant": "元 宗寶編"
      },
      "sourceURI": "https://github.com/cbeta-org/xml-p5",
      "revision": "2b8ab8d5e4fe957a9b94f2cde01cb0d2e2dcd2b9",
      "retrievedOn": "2026-07-26",
      "rights": {
        "status": "restricted-noncommercial",
        "commercialUse": "requires-permission",
        "redistribution": "header-required",
        "statement": "Registered only as an immutable noncommercial collation reference. Commercial use requires prior CBETA permission and distribution must preserve required source/version information.",
        "statementURI": "https://www.cbeta-org-tw.cbeta.org/copyright.htm"
      },
      "artifacts": [
        {
          "locator": "https://raw.githubusercontent.com/cbeta-org/xml-p5/2b8ab8d5e4fe957a9b94f2cde01cb0d2e2dcd2b9/T/T48/T48n2008.xml",
          "pathWithinSource": "T/T48/T48n2008.xml",
          "bytes": 343630,
          "sha256": "af0b463d3f1685972bf22d78ee21da35746c5eacb025ec207ee092cdf4785b9f"
        }
      ]
    }
  ]
}
